S_no,job_company,job_role,job_level,job_experience_min,job_experience_max,job_industry,job_functions,job_skills,,,,,,,,,,,,,,,,,,,,
1,GeoIQ.io,Back End Developer,Mid-Senior level,,NA,Information Technology & Services, Engineering Information Technology ,PostgreSQL C Python SQL,,,,,,,,,,,,,,,,,,,,
2,Mirafra Technologies,BackEnd Developer,Entry level,1,2,Semiconductors, Engineering Information Technology ,PostgreSQL C Python HTML5 CSS SQL JavaScript CSS3,,,,,,,,,,,,,,,,,,,,
3,Recruitrix,Backend Developer,Mid-Senior level,5,NA,Information Technology & Services, Information Technology ,Java Python,,,,,,,,,,,,,,,,,,,,
4,Directi,Backend Engineer,Entry level,,NA,Internet, Engineering Information Technology ,Java Python Golang SQL,,,,,,,,,,,,,,,,,,,,
5,Y Media Labs,Backend Engineer,Entry level,,NA,Internet, Engineering Information Technology ,C Java Python SQL JavaScript Ruby PHP,,,,,,,,,,,,,,,,,,,,
6,MOURI Tech,Backend Developers,Director,5,9,Information Technology & Services, Engineering Information Technology ,Node.js HTML5 JavaScript NodeJS,,,,,,,,,,,,,,,,,,,,
7,Telstra,Software Engineer - Backend NodeJS,Entry level,3,6,Telecommunications, Information Technology Other ,C,,,,,,,,,,,,,,,,,,,,
8,Amazon,Software Development Engineer,Mid-Senior level,,NA,Internet, Information Technology Consulting Engineering ,Oracle C C# Java C++ SQL JavaScript Ruby,,,,,,,,,,,,,,,,,,,,
9,Recko Inc.,Backend Developer,Entry level,4,4,Computer Software, Engineering Information Technology ,Oracle C Java Node.js Spring SQL,,,,,,,,,,,,,,,,,,,,
10,Busigence,Backend Developer,Entry level,0,NA,Information Technology & Services, Engineering Information Technology ,Spark Python Node.js CSS JavaScript,,,,,,,,,,,,,,,,,,,,
11,Lookout,Staff Software Engineer- Backend,Associate,8,NA,Computer & Network Security, Engineering Information Technology ,C Java SQL Ruby Scala,,,,,,,,,,,,,,,,,,,,
12,Zyoin,Software Architect - Backend,9 applicants,10,3,Staffing & Recruiting, Information Technology Engineering Strategy/Planning ,C Java NA Golang Spring SQL JavaScript NodeJS,,,,,,,,,,,,,,,,,,,,
13,upGrad,Lead Data Engineer,185 applicants,8,NA,E-learning, Information Technology Engineering ,C Spark Python NA SQL Scala,,,,,,,,,,,,,,,,,,,,
14,Analytics India Magazine,Python Backend Developer,Associate,,NA,Online Media, Engineering Information Technology ,Python,,,,,,,,,,,,,,,,,,,,
15,Vamstar,Backend Engineer,202 applicants,6,8,Hospital & Health Care, Engineering Information Technology ,Node.js React,,,,,,,,,,,,,,,,,,,,
16,DISH Network,"Backend Developer(Java,Golang)",Mid-Senior level,4,5,Telecommunications, Information Technology Engineering ,PostgreSQL C Spark Java Python NA SQL,,,,,,,,,,,,,,,,,,,,
17,Smarsh,Backend Java Developer-Data Management Engineer,29 applicants,,NA,Information Technology & Services, Engineering Information Technology Other ,C Java,,,,,,,,,,,,,,,,,,,,
18,Barclays,Software Developer,Associate,8,NA,Financial Services, Engineering Information Technology ,C C# Java Python Scala,,,,,,,,,,,,,,,,,,,,
19,INVINCIBLE LIMITED,Backend Developer,Entry level,2,3,"Leatherhead, England", Engineering Information Technology ,C Python CSS SQL JavaScript,,,,,,,,,,,,,,,,,,,,
20,"Magnitude Software, Inc",Software Engineer,Entry level,5,3,Computer Software, Engineering Information Technology ,C# NA ASP.NET SQL JavaScript Angular React,,,,,,,,,,,,,,,,,,,,
21,Skylo Technologies,Lead Backend Engineer,Mid-Senior level,10,NA,Telecommunications, Engineering Information Technology ,C Java SQL,,,,,,,,,,,,,,,,,,,,
22,OptumSoft,Backend web developer - Internet of Things,"1,349 applicants",,NA,Computer Software, Information Technology ,C Java Python HTML5 JavaScript CSS3,,,,,,,,,,,,,,,,,,,,
23,Rakuten India,Senior Backend Engineer,Associate,6,NA,Internet, Engineering Information Technology ,Spark Java Python Golang,,,,,,,,,,,,,,,,,,,,
24,Rakuten India,Senior Backend Engineer,Associate,6,NA,Internet, Engineering Information Technology ,Spark Java Python Golang,,,,,,,,,,,,,,,,,,,,
25,KNOREX,Software Engineer (BackEnd),Entry level,1,5,Internet, Engineering Information Technology ,C Java Spring Hibernate SQL JavaScript Angular,,,,,,,,,,,,,,,,,,,,
26,"Rubrik, Inc.",Software Engineer - Test,Entry level,5,2,Computer Software, Engineering Information Technology ,C Python SQL,,,,,,,,,,,,,,,,,,,,
27,KredX,Back End Engineer,Mid-Senior level,2,NA,Financial Services, Engineering Information Technology ,Java SQL,,,,,,,,,,,,,,,,,,,,
28,Cardiotrack,Back End Developer,Mid-Senior level,2,NA,"Health, Wellness & Fitness", Engineering Information Technology ,C Java SQL,,,,,,,,,,,,,,,,,,,,
29,Womply,Software Engineer - Backend,190 applicants,4,NA,Internet, Engineering Information Technology ,PostgreSQL C Java Python NA SQL Ruby,,,,,,,,,,,,,,,,,,,,
30,Kaleyra,Python- Backend Developer,Mid-Senior level,5,8,Computer Software, Information Technology ,Java Python Golang CSS SQL JavaScript,,,,,,,,,,,,,,,,,,,,
31,Tata CLiQ,Engineering Manager - Backend,104 applicants,10,12,Internet, Engineering ,C Java SQL,,,,,,,,,,,,,,,,,,,,
32,Cloudera,Sr. Software Engineer,Mid-Senior level,6,NA,Computer Software, Engineering Information Technology ,C Spark Java Scala,,,,,,,,,,,,,,,,,,,,
33,Turnip.gg,Backend Developer,Entry level,,NA,Online Media, Engineering Information Technology ,C Java Node.js,,,,,,,,,,,,,,,,,,,,
34,Z1 Media,Backend Developer,Entry level,2,5,Internet, Engineering Information Technology ,C NA PHP,,,,,,,,,,,,,,,,,,,,
35,BirdEye,Backend Engineer (Java) Full stack,324 applicants,3,5,Computer Software, Customer Service ,Oracle SQL,,,,,,,,,,,,,,,,,,,,
36,Fidelity Investments,Principal - Software Engineering,Mid-Senior level,,NA,Financial Services, Quality Assurance Information Technology Engineering ,Oracle C Java CSS Spring SQL JavaScript Angular,,,,,,,,,,,,,,,,,,,,
37,Goldman Sachs,Consumer Technology- Back-End Developer,Entry level,3,NA,Financial Services, Engineering Information Technology ,C Java Spring SQL,,,,,,,,,,,,,,,,,,,,
38,Noodle.ai,Noodle.ai - Python Developer - C++/Java (2-7 yrs) Bangalore (Backend Developer),Entry level,,NA,Computer Software, Engineering Information Technology ,C Java Python C++,,,,,,,,,,,,,,,,,,,,
39,Walmart Labs India,Software Engineer III,Associate,3,6,Information Technology & Services, Engineering Information Technology ,C,,,,,,,,,,,,,,,,,,,,
40,Quess Corp Limited,Backend Services Developer,Entry level,20,300,Staffing & Recruiting, Engineering Information Technology ,C C# NA SQL,,,,,,,,,,,,,,,,,,,,
41,Mphasis,Java Engineer - AWS,Entry level,5,NA,Information Technology & Services, Engineering Information Technology ,C Java CSS Spring Hibernate SQL JavaScript,,,,,,,,,,,,,,,,,,,,
42,Mad Street Den,Back-end Engineer,49 applicants,2,5,Computer Software, Engineering Research Other ,C Python,,,,,,,,,,,,,,,,,,,,
43,Stealth Mode Startup Company,Software Engineer - Backend,159 applicants,6,NA,Information Technology & Services, Engineering Information Technology ,C Spark Python,,,,,,,,,,,,,,,,,,,,
44,Rakuten India,Senior Backend Engineer,Associate,6,NA,Internet, Engineering Information Technology ,Spark Java Python Golang,,,,,,,,,,,,,,,,,,,,
45,Ceequence Technologies,Android Developer,Entry level,20,5,Outsourcing/Offshoring, Engineering Information Technology ,C Java,,,,,,,,,,,,,,,,,,,,
46,Meesho,Engineering Manager - Backend,295 applicants,8,NA,Internet, Engineering Information Technology ,C Spark Java Python ReactJS Spring SQL NodeJS,,,,,,,,,,,,,,,,,,,,
47,Harness,Staff Software Engineer - Backend (Bangalore) (Platform),Associate,4,10,Computer Software, Engineering Information Technology ,C Java,,,,,,,,,,,,,,,,,,,,
48,Groupon,Data Engineer,714 applicants,2,NA,Internet, Information Technology Engineering ,C Spark Java SQL Scala,,,,,,,,,,,,,,,,,,,,
49,CyberArk,Senior Software Engineer (Backend),Mid-Senior level,5,NA,Computer Software, Engineering Information Technology ,C C# ASP.NET CSS SQL JavaScript,,,,,,,,,,,,,,,,,,,,
50,Hitachi Vantara,Web Developer - Frontend & Microsites,Entry level,5,5,Information Technology & Services, Engineering Information Technology ,C HTML5 CSS JavaScript Ruby CSS3 PHP,,,,,,,,,,,,,,,,,,,,
51,G2,Frontend Engineer,Entry level,4,6,Internet, Engineering Information Technology ,C JavaScript Angular,,,,,,,,,,,,,,,,,,,,
52,Locaguide,Lead,10 applicants,4,2,"Leisure, Travel & Tourism", Information Technology Engineering ,C Node.js HTML5 SQL JavaScript React CSS3 PHP,,,,,,,,,,,,,,,,,,,,
53,Neemtree,Backend Engineer,Entry level,7,2,Staffing & Recruiting, Engineering Information Technology ,PostgreSQL C Python Golang SQL,,,,,,,,,,,,,,,,,,,,
54,Twilio Inc.,Data Analyst,"1,644 applicants",5,5,Internet, Information Technology Other Engineering ,C Java Python SQL Scala,,,,,,,,,,,,,,,,,,,,
55,Nevvit Technologies,Backend Developer(Node.JS),107 applicants,,NA,Human Resources, Information Technology ,Node.js JavaScript,,,,,,,,,,,,,,,,,,,,
56,Orcapod,Back End Developer,337 applicants,3,2,Computer Software, Engineering Information Technology ,Java SQL,,,,,,,,,,,,,,,,,,,,
57,Alation,Software Engineer,Mid-Senior level,2,6,Computer Software, Engineering Information Technology ,C Python React,,,,,,,,,,,,,,,,,,,,
58,athenahealth,Lead Member Of Technical Staff(Backend Developer),88 applicants,9,NA,Information Technology & Services, Engineering Information Technology ,C Java Spring Hibernate SQL,,,,,,,,,,,,,,,,,,,,
59,Sumo Logic,Senior Backend Software Engineer - Data Collections,Associate,3,NA,Computer Software, Engineering Information Technology ,C Java NA C++ Ruby Scala,,,,,,,,,,,,,,,,,,,,
60,DistilINFO Publications,Technical come Backend Support,304 applicants,,NA,Information Services, Information Technology ,C,,,,,,,,,,,,,,,,,,,,
61,DocsApp,Software Engineer - Frontend,Associate,0,1,"Health, Wellness & Fitness", Engineering Information Technology ,C HTML5 AngularJS CSS JavaScript AngularJS Angular React,,,,,,,,,,,,,,,,,,,,
62,Rheo,Software Engineer,Associate,,NA,Online Media, Engineering Information Technology ,C Python Golang,,,,,,,,,,,,,,,,,,,,
63,Artivatic.ai [Insurtech],Artivatic.ai - Backend Developer - Python/Java/Performance Tuning (2-5 yrs) Bangalore (Analytics & Data Science),Entry level,4,4,Insurance, Other ,PostgreSQL C Java Python Golang Spring SQL Scala,,,,,,,,,,,,,,,,,,,,
64,BookMyShow,Engineering Manager (Backend Development),90 applicants,9,14,Entertainment, Information Technology Engineering ,C Node.js React,,,,,,,,,,,,,,,,,,,,
65,Webscale Networks,Software Engineer,Entry level,,NA,Computer Software, Engineering Information Technology ,C C++ Golang C/C++,,,,,,,,,,,,,,,,,,,,
66,Wisemonk,BE Developers (SDE II),Associate,3,NA,Information Services, Engineering Information Technology ,C Node.js HTML5 JavaScript,,,,,,,,,,,,,,,,,,,,
67,Neo-Bank,Technical Lead - Backend,123 applicants,6,10,Internet, Engineering Information Technology ,C Java Python Golang SQL NodeJS,,,,,,,,,,,,,,,,,,,,
68,Cohesity,Sr. Software Engineer (Datapath Pune Team),161 applicants,,NA,Computer Software, Information Technology Other ,C C++,,,,,,,,,,,,,,,,,,,,
69,Eyeota,Back End Developer,Mid-Senior level,2,NA,Marketing & Advertising, Engineering Information Technology ,C Java SQL,,,,,,,,,,,,,,,,,,,,
70,Medlife.com,Principal Engineer - Backend,Director,8,NA,Information Technology & Services, Engineering Information Technology ,C Java Python Spring Hibernate SQL,,,,,,,,,,,,,,,,,,,,
71,Khoros,Senior Software Engineer - Frontend,Mid-Senior level,8,6,Computer Software, Engineering Information Technology ,C Java CSS JavaScript React,,,,,,,,,,,,,,,,,,,,
72,enVista,Software Associate,152 applicants,,NA,Logistics & Supply Chain, Engineering Information Technology ,C Java AngularJS JavaScript AngularJS NodeJS,,,,,,,,,,,,,,,,,,,,
73,IndianMoney.com,Full Stack Engineer,Mid-Senior level,1,4,Financial Services, Information Technology ,Python SQL NodeJS PHP,,,,,,,,,,,,,,,,,,,,
74,Mercedes-Benz AG,Data Collector Backend Dev. Engineer,Entry level,7,10,Automotive, Administrative ,C Java Spring,,,,,,,,,,,,,,,,,,,,
75,Jiguar,Android Developer,Entry level,1,4,Information Technology & Services, Engineering Information Technology ,Java,,,,,,,,,,,,,,,,,,,,
76,K12 Techno Services Pvt. Ltd.,Back End Developer,190 applicants,12,3,Education Management, Engineering Information Technology ,PostgreSQL C Java Python C++ C/C++ SQL JavaScript,,,,,,,,,,,,,,,,,,,,
77,IBM,Full Stack Developer,90 applicants,12,3,Information Technology & Services, Engineering Information Technology ,Oracle C Java Python Node.js CSS Spring Hibernate SQL JavaScript Ruby Angular React Scala PHP,,,,,,,,,,,,,,,,,,,,
78,Luxoft,BigData Consultant,Associate,2,NA,Information Technology & Services, Other Information Technology Engineering ,Spark Java Scala,,,,,,,,,,,,,,,,,,,,
79,Telyport,iOS Developer,Entry level,,NA,Logistics & Supply Chain, Engineering Information Technology ,C,,,,,,,,,,,,,,,,,,,,
80,moneyguru,iOS Developer,179 applicants,60,3,Financial Services, Engineering Information Technology ,C Angular,,,,,,,,,,,,,,,,,,,,
81,CitiusTech,Technical Lead-Python,9 applicants,7,11,Information Technology & Services, Engineering Information Technology ,C Python HTML5 SQL JavaScript Angular,,,,,,,,,,,,,,,,,,,,
82,Netomi,Netomi - Software Development Engineer I - Java/Spring/Rest Webservices (1-3 yrs) Gurgaon/Gurugram (Backend Developer),Entry level,1,3,Internet, Engineering Information Technology ,Spark Java Spring,,,,,,,,,,,,,,,,,,,,
83,SapienHR® Analytics,Full Stack Engineer - Java/Python/C# (3-8 yrs) Bangalore (Backend Developer),Entry level,3,NA,Staffing & Recruiting, Engineering Information Technology ,C Spark C# Java Python Node.js ReactJS AngularJS SQL AngularJS,,,,,,,,,,,,,,,,,,,,
84,91mobiles,Software Engineer,Entry level,2,3,Consumer Electronics, Engineering Information Technology ,Java SQL PHP,,,,,,,,,,,,,,,,,,,,
85,Dunzo,Senior Android Developer,Director,,NA,Internet, Engineering Information Technology ,C,,,,,,,,,,,,,,,,,,,,
86,T-Systems ICT India Pvt. Ltd.,"Java Backend Developer (Mandatory -SpringBoot,Microservices) )",Associate,6,10,Information Technology & Services, Information Technology ,Java SQL,,,,,,,,,,,,,,,,,,,,
87,Enterprise Bot | Empower Digital Conversations with AI,Senior Backend Developer - Node.js,Mid-Senior level,2,5,Information Technology & Services, Information Technology ,C HTML5 JavaScript CSS3 NodeJS,,,,,,,,,,,,,,,,,,,,
88,airtel X Labs,Lead Engineer | Backend,251 applicants,5,8,Internet, Engineering Information Technology ,C Java Python SQL,,,,,,,,,,,,,,,,,,,,
89,ZopSmart,Golang Developer,Entry level,1,NA,Computer Software, Engineering Information Technology ,C Java Python C++ Golang SQL PHP,,,,,,,,,,,,,,,,,,,,
90,Informatica,Associate Software Engineer,Entry level,,NA,Computer Software, Quality Assurance Design Engineering ,C Spark Java Spring,,,,,,,,,,,,,,,,,,,,
91,Maven,Technical Lead - Software Development - Java/Python (6-9 yrs) Bangalore (Backend Developer),Associate,,NA,Computer Software, Engineering Information Technology ,C Java Python,,,,,,,,,,,,,,,,,,,,
92,KyePot,KyePot Technologies - Full Stack Developer - Java/Spring Boot/Microservices (4-15 yrs) Bangalore (Backend Developer),Entry level,30,NA,Financial Services, Engineering Information Technology ,C Java NA Spring SQL JavaScript React,,,,,,,,,,,,,,,,,,,,
93,91springboard,Python Developer,150 applicants,4,5,Hospitality, Engineering Information Technology Design ,C Java Python HTML5 JavaScript,,,,,,,,,,,,,,,,,,,,
94,LimeTray,LimeTray - Software Engineer II - Java (2-4 yrs) Gurgaon/Gurugram (Backend Developer),Entry level,2,NA,Information Technology & Services, Engineering Information Technology ,C Java Spring SQL Angular React,,,,,,,,,,,,,,,,,,,,
95,Target,Principal Engineer - Bigdata,Associate,10,NA,Retail, Engineering Information Technology ,C Spark,,,,,,,,,,,,,,,,,,,,
96,Avalara,SDET,Entry level,6,8,Computer Software, Engineering Information Technology ,C C# Java SQL JavaScript PHP,,,,,,,,,,,,,,,,,,,,
97,Kiwi India Private Limited,Android Developer,Mid-Senior level,3,NA,Computer Software, Engineering Information Technology ,,,,,,,,,,,,,,,,,,,,,
98,Commvault,Full Stack Developers,Entry level,5,5,Computer Software, Engineering Information Technology ,C C# Java CSS JavaScript Angular,,,,,,,,,,,,,,,,,,,,
99,Unilog,Unilog - Software Engineer - Java Technologies (3-5 yrs) Mysore (Backend Developer),Associate,,NA,Computer Software, Engineering Information Technology ,Oracle C Java CSS Spring SQL JavaScript,,,,,,,,,,,,,,,,,,,,
100,Greenhandle,Web Developer,48 applicants,2,1,Internet, Engineering Information Technology ,C SQL PHP,,,,,,,,,,,,,,,,,,,,
101,BuzzHire -We hire to create buzz!,Backend Developer - Java Technologies (7-15 yrs) Bangalore (Backend Developer),Entry level,3,NA,Human Resources, Engineering Information Technology ,Java JavaScript Angular React,,,,,,,,,,,,,,,,,,,,
102,Educomp Solutions Ltd,Python Developer - Linux/Django (2-6 yrs) Bangalore (Backend Developer),Entry level,,NA,E-learning, Engineering Information Technology ,C Java Python SQL,,,,,,,,,,,,,,,,,,,,
103,Tracxn,Tracxn - SDE II - Full Stack - Node.js/Express.js/React.js/MongoDB (1-5 yrs) Bangalore (Backend Developer),Entry level,,NA,Venture Capital & Private Equity, Engineering Information Technology ,C Java Python Node.js ReactJS Spring SQL Angular React NodeJS,,,,,,,,,,,,,,,,,,,,
104,Acceleron Corp,Software Engineer,189 applicants,1,5,Computer Software, Engineering ,C,,,,,,,,,,,,,,,,,,,,
105,Heady,Heady Technologies - Senior Software Development Engineer - Test - Javascript/TypeScript (5-10 yrs) Mumbai (Quality Assurance),Associate,3,NA,Information Technology & Services, Engineering Information Technology ,Node.js JavaScript,,,,,,,,,,,,,,,,,,,,
106,Zycus,Associate Director - Product development,Director,14,5,Computer Software, Information Technology Engineering ,C Spark Java Node.js NA SQL Angular React Scala,,,,,,,,,,,,,,,,,,,,
107,Fivetran,Staff Software Engineer,Director,9,NA,Computer Software, Engineering Information Technology ,C Java SQL,,,,,,,,,,,,,,,,,,,,
108,HealtheLife Ventures LLP,Healthelife - Java Developer - J2EE/Hibernate/Spring Boot (3-6 yrs) Bangalore (Backend Developer),Entry level,4,NA,Information Technology & Services, Engineering Information Technology ,C Java Spring SQL,,,,,,,,,,,,,,,,,,,,
109,Zeta India,Senior Software Development Engineer - Backend - Enterprise Payments,Associate,4,NA,Internet, Engineering Information Technology ,C Java SQL,,,,,,,,,,,,,,,,,,,,
110,Clari,Senior Software Engineer,Associate,5,NA,Computer Software, Engineering Information Technology ,C Java SQL JavaScript,,,,,,,,,,,,,,,,,,,,
111,NetAnalytiks,Python Developer - Javascript/Numpy (5-9 yrs) Bangalore (Backend Developer),Entry level,4,NA,Information Technology & Services, Engineering Information Technology ,C Python HTML5 JavaScript CSS3,,,,,,,,,,,,,,,,,,,,
112,Riskcovry,Ruby on Rails Backend Developer,62 applicants,3,10,Information Technology & Services, Information Technology ,Ruby,,,,,,,,,,,,,,,,,,,,
113,SHL,Software Engineer (FE),Mid-Senior level,3,5,Human Resources, Engineering Information Technology ,C Java HTML5 AngularJS JavaScript AngularJS React CSS3 NodeJS,,,,,,,,,,,,,,,,,,,,
114,Bay-Forge Limited,Principal Software Engineer - Java/Python/Ruby (8-15 yrs) Bangalore (Backend Developer),Associate,,NA,Mechanical Or Industrial Engineering, Engineering Information Technology ,Java Python JavaScript Ruby Angular React,,,,,,,,,,,,,,,,,,,,
115,Arcadis,Software Engineer (Full Stack Developer),66 applicants,,NA,Civil Engineering, Design Consulting Engineering ,C AngularJS ASP.NET AngularJS React NodeJS,,,,,,,,,,,,,,,,,,,,
116,Openhouse,Full Stack Software Engineer,178 applicants,4,NA,Education Management, Engineering ,C Python SQL React,,,,,,,,,,,,,,,,,,,,
117,Solvative,Android Developer,211 applicants,,NA,Information Technology & Services, Information Technology Engineering ,Java CSS JavaScript NodeJS,,,,,,,,,,,,,,,,,,,,
118,Core HR Services Pvt. Ltd,Backend Developer,Entry level,1,NA,Human Resources, Engineering Information Technology ,PHP,,,,,,,,,,,,,,,,,,,,
119,The Glove,Software Engineer,432 applicants,7,NA,Staffing & Recruiting, Engineering Information Technology ,C Java Python ReactJS,,,,,,,,,,,,,,,,,,,,
120,Copper Mobile,Back End Developer,94 applicants,2,3,Computer Software, Engineering Information Technology ,C SQL PHP,,,,,,,,,,,,,,,,,,,,
121,Knitter,Senior Android  Developer,738 applicants,,NA,Internet, Engineering Information Technology ,C,,,,,,,,,,,,,,,,,,,,
122,LikeMinds,Backend Lead,207 applicants,2,30,Internet,NA,,,,,,,,,,,,,,,,,,,,,
123,What a Story,Web Developer,Entry level,,NA,Marketing & Advertising, Engineering Information Technology ,C CSS React PHP,,,,,,,,,,,,,,,,,,,,
124,Numerator,Engineer - Python / ETL,Entry level,5,2,Market Research, Business Development Sales ,C C# Java Python SQL Angular React,,,,,,,,,,,,,,,,,,,,
125,nexChange.in,Lead Java Developer - J2EE/Struts/Hibernate (6-10 yrs) Bangalore (Backend Developer),Associate,2,NA,Staffing & Recruiting, Engineering Information Technology ,C Java Spring Hibernate SQL,,,,,,,,,,,,,,,,,,,,
126,Navi,SDE-3,25 applicants,5,NA,Financial Services, Engineering ,C Java SQL,,,,,,,,,,,,,,,,,,,,
127,ORMAE,Frontend Developer,219 applicants,2,6,Logistics & Supply Chain, Design Art/Creative Information Technology ,C HTML5 CSS JavaScript Angular React,,,,,,,,,,,,,,,,,,,,
128,KeyValue Software Systems,Back End Developer,Associate,,NA,Computer Software, Engineering Information Technology ,Java Python Golang SQL Scala,,,,,,,,,,,,,,,,,,,,
129,Super Smelters Limited,Software Developer - IoT System Design (3-4 yrs) Noida (Backend Developer),Entry level,,NA,Mining & Metals, Engineering Information Technology ,C Java Python SQL NodeJS,,,,,,,,,,,,,,,,,,,,
130,JPMorgan Chase & Co.,Software Engineer - Java,Entry level,5,2,Financial Services, Engineering Information Technology ,C Java Spring Hibernate,,,,,,,,,,,,,,,,,,,,
131,LambdaTest,LambdaTest - Backend Engineer - Python/Node.js/Golang (1-4 yrs) Noida,Entry level,1,4,Computer Software, Engineering Information Technology ,C Java Python Golang PHP,,,,,,,,,,,,,,,,,,,,
132,H2O.ai,Full Stack Senior Software Engineer,6 applicants,3,10,Computer Software, Engineering Information Technology ,C Java Python Scala,,,,,,,,,,,,,,,,,,,,
133,Johnson Controls,Full Stack Engineer,Mid-Senior level,3,4,Mechanical Or Industrial Engineering, Information Technology Engineering ,Oracle Java Spring SQL JavaScript Angular,,,,,,,,,,,,,,,,,,,,
134,Software AG,Java Developer - Software Engineer/Senior Software Engineer,Mid-Senior level,3,2,Computer Software, Information Technology Engineering ,Oracle C Java SQL Angular,,,,,,,,,,,,,,,,,,,,
135,Keyfill Light,PHP Developer,9 applicants,1,2,Information Technology & Services, Information Technology ,C SQL JavaScript PHP,,,,,,,,,,,,,,,,,,,,
136,Treebo Hotels,Principal Architect - Backend,145 applicants,10,NA,Hospitality, Information Technology ,,,,,,,,,,,,,,,,,,,,,
137,Qualys,Senior QA Automation Engineer,Associate,4,75,Computer & Network Security, Quality Assurance ,C Java Python SQL,,,,,,,,,,,,,,,,,,,,
138,Pegasystems,Associate Architect,Entry level,9,NA,Computer Software, Design Art/Creative Information Technology ,C Java,,,,,,,,,,,,,,,,,,,,
139,Market Pulse Tech,Elixir Developer,25 applicants,,NA,Internet, Engineering ,Ruby,,,,,,,,,,,,,,,,,,,,
140,BP Ergo Ltd,Web Developer,Entry level,,NA,Furniture, Engineering Information Technology ,C ASP.NET CSS JavaScript Ruby PHP,,,,,,,,,,,,,,,,,,,,
141,Conviva,"Lead Software Engineer, Big Data",Mid-Senior level,8,4,Internet, Engineering Information Technology ,C Spark SQL Scala,,,,,,,,,,,,,,,,,,,,
142,ISS | Institutional Shareholder Services,Application Software Developer,Entry level,2,3,Financial Services, Engineering Information Technology ,Java AngularJS CSS Spring SQL AngularJS PHP,,,,,,,,,,,,,,,,,,,,
143,ThoughtSpot,Senior Member of Technical Staff - Backend,Associate,7,NA,Computer Software, Engineering Information Technology ,C,,,,,,,,,,,,,,,,,,,,
144,People Interactive,DevOps Engineer,307 applicants,2,3,Internet, Information Technology ,C,,,,,,,,,,,,,,,,,,,,
145,Intel Corporation,Senior Backend Design Engineer,Associate,,NA,Semiconductors, Engineering Information Technology ,C Python,,,,,,,,,,,,,,,,,,,,
146,Cornertree Productions,Backend Developer - Java/Ruby Programming (3-5 yrs) Gurgaon/Gurugram (Backend Developer),Entry level,3,3,Motion Pictures & Film, Engineering Information Technology ,C Java Python CSS JavaScript Ruby PHP,,,,,,,,,,,,,,,,,,,,
147,People Gamut HR Solutions,Backend Developer - Java/Golang (5-8 yrs) Bangalore (Backend Developer),Entry level,5,8,Human Resources, Engineering Information Technology ,C Java C++ Golang SQL,,,,,,,,,,,,,,,,,,,,
148,Rapyder (Hiring Cloud Engineering Talent!!),Full Stack Java Developer,Associate,1,2,Information Technology & Services, Information Technology ,C Java Node.js Spring Hibernate Angular,,,,,,,,,,,,,,,,,,,,
149,Josh Technology Group,Senior Software Developer I - Python/Django (2-5 yrs) Gurgaon/Gurugram (Backend Developer),Associate,,NA,Information Technology & Services, Engineering Information Technology ,C Python Angular React,,,,,,,,,,,,,,,,,,,,
150,GitHub,Senior Software Engineer,Mid-Senior level,8,NA,Computer Software, Engineering Information Technology ,C# SQL JavaScript Ruby,,,,,,,,,,,,,,,,,,,,
151,MakeMyTrip,Frontend Web Developer,732 applicants,,NA,Internet, Engineering Information Technology ,C HTML5 JavaScript React CSS3,,,,,,,,,,,,,,,,,,,,
152,ConvertCart,Sr UI Developer - Team Lead,16 applicants,5,8,Internet, Engineering Information Technology ,C CSS JavaScript,,,,,,,,,,,,,,,,,,,,
153,Ally.io,Senior Frontend Engineer,Associate,4,7,Computer Software, Engineering Information Technology ,C JavaScript Ruby Angular React,,,,,,,,,,,,,,,,,,,,
154,Technostacks Infotech Pvt. Ltd.,Android Developer,Entry level,1,3,Information Technology & Services, Engineering Information Technology ,C Java,,,,,,,,,,,,,,,,,,,,
